{
  "$schema": "../schemas/shadcn-ui-registry.schema.json",
  "version": "1.1.1",
  "source": "https://ui.shadcn.com/",
  "upstreamRepository": "https://github.com/shadcn-ui/ui",
  "upstreamRef": "refs/heads/main",
  "upstreamCommit": "b4a618b97e35f5dadf3a00d51f410c84a2567d4d",
  "scope": "official registry:ui component sources for every declared base",
  "count": 182,
  "fileCount": 182,
  "variants": [
    {
      "id": "aria",
      "title": "React Aria",
      "count": 59
    },
    {
      "id": "base",
      "title": "Base UI",
      "count": 62
    },
    {
      "id": "radix",
      "title": "Radix UI",
      "count": 61
    }
  ],
  "license": {
    "spdx": "MIT",
    "copyright": "Copyright (c) 2023 shadcn",
    "upstreamPath": "LICENSE.md",
    "sourceURL": "https://github.com/shadcn-ui/ui/blob/b4a618b97e35f5dadf3a00d51f410c84a2567d4d/LICENSE.md",
    "sourcePath": "Sources/ShadcnUI/LICENSE.md",
    "sha256": "1564074e13439397221ffd522e2e504d56561994a23d371aa5e3ad43e4f5423f",
    "bytes": 1063
  },
  "components": [
    {
      "id": "aria/accordion",
      "name": "accordion",
      "variant": "aria",
      "variantTitle": "React Aria",
      "language": "TypeScript TSX",
      "upstreamPath": "apps/v4/registry/bases/aria/ui/accordion.tsx",
      "sourceURL": "https://raw.githubusercontent.com/shadcn-ui/ui/b4a618b97e35f5dadf3a00d51f410c84a2567d4d/apps/v4/registry/bases/aria/ui/accordion.tsx",
      "sourcePath": "Sources/ShadcnUI/Components/Aria/accordion.tsx",
      "sha256": "ddb6963d91acd29e35b938b8808654146e7fd002e12c556dc852e14c06067820",
      "bytes": 3065
    },
    {
      "id": "aria/alert",
      "name": "alert",
      "variant": "aria",
      "variantTitle": "React Aria",
      "language": "TypeScript TSX",
      "upstreamPath": "apps/v4/registry/bases/aria/ui/alert.tsx",
      "sourceURL": "https://raw.githubusercontent.com/shadcn-ui/ui/b4a618b97e35f5dadf3a00d51f410c84a2567d4d/apps/v4/registry/bases/aria/ui/alert.tsx",
      "sourcePath": "Sources/ShadcnUI/Components/Aria/alert.tsx",
      "sha256": "76ad2c55ed42db2713fd05d3c1eec6e2d51b9d266553a44ed7949258f762e302",
      "bytes": 1578
    },
    {
      "id": "aria/alert-dialog",
      "name": "alert-dialog",
      "variant": "aria",
      "variantTitle": "React Aria",
      "language": "TypeScript TSX",
      "upstreamPath": "apps/v4/registry/bases/aria/ui/alert-dialog.tsx",
      "sourceURL": "https://raw.githubusercontent.com/shadcn-ui/ui/b4a618b97e35f5dadf3a00d51f410c84a2567d4d/apps/v4/registry/bases/aria/ui/alert-dialog.tsx",
      "sourcePath": "Sources/ShadcnUI/Components/Aria/alert-dialog.tsx",
      "sha256": "e6969f85248c52a7fe18542ccf1da28d7c39927eac5c80d39d2effb6e7c08640",
      "bytes": 4634
    },
    {
      "id": "aria/aspect-ratio",
      "name": "aspect-ratio",
      "variant": "aria",
      "variantTitle": "React Aria",
      "language": "TypeScript TSX",
      "upstreamPath": "apps/v4/registry/bases/aria/ui/aspect-ratio.tsx",
      "sourceURL": "https://raw.githubusercontent.com/shadcn-ui/ui/b4a618b97e35f5dadf3a00d51f410c84a2567d4d/apps/v4/registry/bases/aria/ui/aspect-ratio.tsx",
      "sourcePath": "Sources/ShadcnUI/Components/Aria/aspect-ratio.tsx",
      "sha256": "bebf893f8ba48911c76b40ee8bd66422fd9c57158c5d969c86d86935a9b07cd5",
      "bytes": 423
    },
    {
      "id": "aria/attachment",
      "name": "attachment",
      "variant": "aria",
      "variantTitle": "React Aria",
      "language": "TypeScript TSX",
      "upstreamPath": "apps/v4/registry/bases/aria/ui/attachment.tsx",
      "sourceURL": "https://raw.githubusercontent.com/shadcn-ui/ui/b4a618b97e35f5dadf3a00d51f410c84a2567d4d/apps/v4/registry/bases/aria/ui/attachment.tsx",
      "sourcePath": "Sources/ShadcnUI/Components/Aria/attachment.tsx",
      "sha256": "958b3862e5b14e07ac8a14c6a0734df5c90b96c24408c092983dd5c358b52866",
      "bytes": 5322
    },
    {
      "id": "aria/avatar",
      "name": "avatar",
      "variant": "aria",
      "variantTitle": "React Aria",
      "language": "TypeScript TSX",
      "upstreamPath": "apps/v4/registry/bases/aria/ui/avatar.tsx",
      "sourceURL": "https://raw.githubusercontent.com/shadcn-ui/ui/b4a618b97e35f5dadf3a00d51f410c84a2567d4d/apps/v4/registry/bases/aria/ui/avatar.tsx",
      "sourcePath": "Sources/ShadcnUI/Components/Aria/avatar.tsx",
      "sha256": "a612d0dca85b9726b3d6d97a82ffa3588b720c99c40a49b3e537a6e0e746f52f",
      "bytes": 2933
    },
    {
      "id": "aria/badge",
      "name": "badge",
      "variant": "aria",
      "variantTitle": "React Aria",
      "language": "TypeScript TSX",
      "upstreamPath": "apps/v4/registry/bases/aria/ui/badge.tsx",
      "sourceURL": "https://raw.githubusercontent.com/shadcn-ui/ui/b4a618b97e35f5dadf3a00d51f410c84a2567d4d/apps/v4/registry/bases/aria/ui/badge.tsx",
      "sourcePath": "Sources/ShadcnUI/Components/Aria/badge.tsx",
      "sha256": "89f2b2adb3385b14a76b5b2e6c0ad14808ecb9922307921a20d9a1388766c0f8",
      "bytes": 1508
    },
    {
      "id": "aria/breadcrumb",
      "name": "breadcrumb",
      "variant": "aria",
      "variantTitle": "React Aria",
      "language": "TypeScript TSX",
      "upstreamPath": "apps/v4/registry/bases/aria/ui/breadcrumb.tsx",
      "sourceURL": "https://raw.githubusercontent.com/shadcn-ui/ui/b4a618b97e35f5dadf3a00d51f410c84a2567d4d/apps/v4/registry/bases/aria/ui/breadcrumb.tsx",
      "sourcePath": "Sources/ShadcnUI/Components/Aria/breadcrumb.tsx",
      "sha256": "0934abccf39998c20e606d086bf896bcd7e3e276b2bf96ec8927c1a969590e6c",
      "bytes": 3271
    },
    {
      "id": "aria/bubble",
      "name": "bubble",
      "variant": "aria",
      "variantTitle": "React Aria",
      "language": "TypeScript TSX",
      "upstreamPath": "apps/v4/registry/bases/aria/ui/bubble.tsx",
      "sourceURL": "https://raw.githubusercontent.com/shadcn-ui/ui/b4a618b97e35f5dadf3a00d51f410c84a2567d4d/apps/v4/registry/bases/aria/ui/bubble.tsx",
      "sourcePath": "Sources/ShadcnUI/Components/Aria/bubble.tsx",
      "sha256": "ef370d5d83794bb98b0532067fcae42a565dd0375827f349da9b77db7361a922",
      "bytes": 3025
    },
    {
      "id": "aria/button",
      "name": "button",
      "variant": "aria",
      "variantTitle": "React Aria",
      "language": "TypeScript TSX",
      "upstreamPath": "apps/v4/registry/bases/aria/ui/button.tsx",
      "sourceURL": "https://raw.githubusercontent.com/shadcn-ui/ui/b4a618b97e35f5dadf3a00d51f410c84a2567d4d/apps/v4/registry/bases/aria/ui/button.tsx",
      "sourcePath": "Sources/ShadcnUI/Components/Aria/button.tsx",
      "sha256": "829985d7141e69589ca7c68f84fe2585658888fe02edd64f86b55bd8c452687a",
      "bytes": 2267
    },
    {
      "id": "aria/button-group",
      "name": "button-group",
      "variant": "aria",
      "variantTitle": "React Aria",
      "language": "TypeScript TSX",
      "upstreamPath": "apps/v4/registry/bases/aria/ui/button-group.tsx",
      "sourceURL": "https://raw.githubusercontent.com/shadcn-ui/ui/b4a618b97e35f5dadf3a00d51f410c84a2567d4d/apps/v4/registry/bases/aria/ui/button-group.tsx",
      "sourcePath": "Sources/ShadcnUI/Components/Aria/button-group.tsx",
      "sha256": "4b9b7373abae4efe9ba8f70f7ce3decd0a9b4756a9b99fae988d790a016267c7",
      "bytes": 2423
    },
    {
      "id": "aria/calendar",
      "name": "calendar",
      "variant": "aria",
      "variantTitle": "React Aria",
      "language": "TypeScript TSX",
      "upstreamPath": "apps/v4/registry/bases/aria/ui/calendar.tsx",
      "sourceURL": "https://raw.githubusercontent.com/shadcn-ui/ui/b4a618b97e35f5dadf3a00d51f410c84a2567d4d/apps/v4/registry/bases/aria/ui/calendar.tsx",
      "sourcePath": "Sources/ShadcnUI/Components/Aria/calendar.tsx",
      "sha256": "52ad93f73c7f29081fba9285c496ff488b555e47a589073e9a511db1214ec7f5",
      "bytes": 10177
    },
    {
      "id": "aria/card",
      "name": "card",
      "variant": "aria",
      "variantTitle": "React Aria",
      "language": "TypeScript TSX",
      "upstreamPath": "apps/v4/registry/bases/aria/ui/card.tsx",
      "sourceURL": "https://raw.githubusercontent.com/shadcn-ui/ui/b4a618b97e35f5dadf3a00d51f410c84a2567d4d/apps/v4/registry/bases/aria/ui/card.tsx",
      "sourcePath": "Sources/ShadcnUI/Components/Aria/card.tsx",
      "sha256": "828ac968787e65d003c7b63b9157c4a4120aec69c1f888bd123f189e8ac3d60b",
      "bytes": 2061
    },
    {
      "id": "aria/carousel",
      "name": "carousel",
      "variant": "aria",
      "variantTitle": "React Aria",
      "language": "TypeScript TSX",
      "upstreamPath": "apps/v4/registry/bases/aria/ui/carousel.tsx",
      "sourceURL": "https://raw.githubusercontent.com/shadcn-ui/ui/b4a618b97e35f5dadf3a00d51f410c84a2567d4d/apps/v4/registry/bases/aria/ui/carousel.tsx",
      "sourcePath": "Sources/ShadcnUI/Components/Aria/carousel.tsx",
      "sha256": "d0b515a433dfac69dffd211b4798de71bee9719be4bd4bb02e4ee6e6b59ce7d3",
      "bytes": 6092
    },
    {
      "id": "aria/chart",
      "name": "chart",
      "variant": "aria",
      "variantTitle": "React Aria",
      "language": "TypeScript TSX",
      "upstreamPath": "apps/v4/registry/bases/aria/ui/chart.tsx",
      "sourceURL": "https://raw.githubusercontent.com/shadcn-ui/ui/b4a618b97e35f5dadf3a00d51f410c84a2567d4d/apps/v4/registry/bases/aria/ui/chart.tsx",
      "sourcePath": "Sources/ShadcnUI/Components/Aria/chart.tsx",
      "sha256": "1e52c40165e5153b0cae96d65b13143ecba83b7002691b560242994e43be3021",
      "bytes": 10447
    },
    {
      "id": "aria/checkbox",
      "name": "checkbox",
      "variant": "aria",
      "variantTitle": "React Aria",
      "language": "TypeScript TSX",
      "upstreamPath": "apps/v4/registry/bases/aria/ui/checkbox.tsx",
      "sourceURL": "https://raw.githubusercontent.com/shadcn-ui/ui/b4a618b97e35f5dadf3a00d51f410c84a2567d4d/apps/v4/registry/bases/aria/ui/checkbox.tsx",
      "sourcePath": "Sources/ShadcnUI/Components/Aria/checkbox.tsx",
      "sha256": "5acc7923d363d7afd231f2ae3b4056fe95e0b462d30f1120c1b108f45b74a4cb",